{
  "$schema": "https://json-schema.org/draft/2020-12/schema",
  "$comment": "Generated by scripts/schemas from trialfolio.contracts.ranking_snapshot.RankingSnapshotRecord, in serialization mode. Validation and serialization modes give the same schema. Never edit it by hand.",
  "$defs": {
    "SnapshotSystem": {
      "additionalProperties": false,
      "description": "The ranking system as `rank_get` returned it, exactly as Portfolio123 gave its fields,\nwith `verified` provenance.",
      "properties": {
        "name": {
          "description": "The response's `name`, recorded as it is, even when it isn't the one requested.",
          "title": "Name",
          "type": "string"
        },
        "id": {
          "title": "Id",
          "type": "integer"
        },
        "ranking_method": {
          "description": "The response's `rankingMethod`, as the integer Portfolio123 gave.",
          "title": "Ranking Method",
          "type": "integer"
        },
        "currency": {
          "title": "Currency",
          "type": "string"
        },
        "type": {
          "title": "Type",
          "type": "string"
        }
      },
      "required": [
        "name",
        "id",
        "ranking_method",
        "currency",
        "type"
      ],
      "title": "SnapshotSystem",
      "type": "object"
    }
  },
  "additionalProperties": false,
  "description": "The snapshot record, `snapshot.json`: the system a snapshot read, when, under which\nattempt and plan, and its files. It doesn't say whether the definition can be a ranking:\nthat's checked each time a configuration names the snapshot.",
  "properties": {
    "schema_version": {
      "const": "1.0.0",
      "title": "Schema Version",
      "type": "string"
    },
    "trialfolio_version": {
      "pattern": "^(0|[1-9][0-9]*)\\.(0|[1-9][0-9]*)\\.(0|[1-9][0-9]*)$",
      "title": "Trialfolio Version",
      "type": "string"
    },
    "requested": {
      "description": "The configuration's `system`.",
      "minLength": 1,
      "pattern": "[^\\t\\n\\v\\f\\r \\u0085\\u00a0\\u1680\\u2000-\\u200a\\u2028\\u2029\\u202f\\u205f\\u3000]",
      "title": "Requested",
      "type": "string"
    },
    "system": {
      "$ref": "#/$defs/SnapshotSystem"
    },
    "taken_at": {
      "description": "When the response arrived: the attempt's `ended_at`.",
      "format": "date-time",
      "title": "Taken At",
      "type": "string"
    },
    "attempt_id": {
      "format": "uuid4",
      "title": "Attempt Id",
      "type": "string"
    },
    "plan_hash": {
      "description": "The plan the snapshot was read under.",
      "pattern": "^sha256:[0-9a-f]{64}$",
      "title": "Plan Hash",
      "type": "string"
    },
    "definition": {
      "description": "The `artifact_id` of `definition.xml`.",
      "pattern": "^sha256:[0-9a-f]{64}$",
      "title": "Definition",
      "type": "string"
    },
    "response": {
      "description": "The `artifact_id` of the saved response.",
      "pattern": "^sha256:[0-9a-f]{64}$",
      "title": "Response",
      "type": "string"
    }
  },
  "required": [
    "schema_version",
    "trialfolio_version",
    "requested",
    "system",
    "taken_at",
    "attempt_id",
    "plan_hash",
    "definition",
    "response"
  ],
  "title": "RankingSnapshotRecord",
  "type": "object"
}
